{
  "$defs": {
    "EnvironmentGrant": {
      "additionalProperties": false,
      "description": "Authority over a declared binding and instances made from its template.",
      "properties": {
        "environment": {
          "$ref": "#/$defs/EnvironmentName"
        },
        "methods": {
          "default": [],
          "items": {
            "type": "string"
          },
          "type": "array"
        },
        "permissions": {
          "items": {
            "$ref": "#/$defs/EnvironmentPermission"
          },
          "type": "array"
        }
      },
      "required": [
        "environment",
        "permissions"
      ],
      "type": "object"
    },
    "EnvironmentName": {
      "pattern": "^[A-Za-z0-9][A-Za-z0-9._:-]{0,127}$",
      "type": "string"
    },
    "EnvironmentPermission": {
      "enum": [
        "read",
        "create",
        "setup",
        "update",
        "delete",
        "call"
      ],
      "type": "string"
    },
    "Tool": {
      "additionalProperties": false,
      "description": "A canonical Tool definition with one implementation per authorized Environment.\nBrain validates dispatched inputs and successful outputs against this definition.",
      "properties": {
        "description": {
          "type": "string"
        },
        "environments": {
          "items": {
            "$ref": "#/$defs/EnvironmentGrant"
          },
          "type": "array"
        },
        "input_schema": {
          "type": "object"
        },
        "name": {
          "pattern": "^[A-Za-z0-9][A-Za-z0-9._:-]{0,127}$",
          "type": "string"
        },
        "output_schema": {
          "type": "object"
        },
        "placements": {
          "additionalProperties": false,
          "description": "One implementation per authorized Environment, fixed at create.",
          "patternProperties": {
            "^[A-Za-z0-9][A-Za-z0-9._:-]{0,127}$": {
              "$ref": "#/$defs/ToolPlacement"
            }
          },
          "type": "object"
        }
      },
      "required": [
        "name",
        "description",
        "input_schema",
        "placements"
      ],
      "type": "object"
    },
    "ToolPlacement": {
      "additionalProperties": false,
      "properties": {
        "implementation": true
      },
      "required": [
        "implementation"
      ],
      "type": "object"
    }
  },
  "$id": "https://github.com/aexhq/brain/crates/brain-protocol/generated/contract/tool/v1/schemas.json",
  "$ref": "#/$defs/Tool",
  "$schema": "https://json-schema.org/draft/2020-12/schema",
  "title": "Brain Tool v1"
}
